{
  "$schema": "../schemas/source_ledger.schema.json",
  "schema_version": "1.0",
  "run_id": "",
  "hard_status": "BLOCKED",
  "status_reason": "No sources registered yet.",
  "sources": [
    {
      "source_ref": "round:cash:period",
      "system": "Round",
      "connector": "round-mcp",
      "description": "Cash balance extract for the requested period.",
      "period": "",
      "entity": "",
      "currency": "GBP",
      "extract_path": "extracts/round/cash.json",
      "source_hash_sha256": "",
      "source_as_of": "",
      "row_count": 0,
      "fetched_at": "",
      "reconciled_to": [],
      "status": "UNRESOLVED",
      "status_reason": "Template row."
    }
  ],
  "open_gaps": [
    {
      "gap_id": "source-gap-001",
      "source_ref": "round:cash:period",
      "reason": "Source not fetched yet.",
      "blocks_final": true
    }
  ]
}
